{"abox_semantic_hash":"211a96fde00ee93bfdfccbb97337e887800ebf6f9a8c48d4d3f95564dadeeb30","combined_input_semantic_hash":"96e28b726a3b9f50a5fd880a3a8e55cc0f7e84f274d8629ff14761d281a6d8b9","consistent":true,"exit_code":0,"hermit_dependency_version":"1.4.5.456","ontology_release_source_hash":"db7e4d7ee514fef1c62a54c688290940e11ef0a1d9a96bb866d7b74c01f3e8fd","reasoner":"HermiT","robot_jar_sha256":"91890c2e83d0f092dd08731376f154b36610544cfbe8685337a1bf7244ccaa2d","robot_version":"1.9.7","source_package_hash":"28a1a81eecdfe74a9d81fa2672824f33aec7670a64823f5cf0219a683ef79b52","status":"CONSISTENT"}
