{"abox_semantic_hash":"fd4b1c75a8a9e7ef56cc921544a50de71892ee14747e6c511b4393c0ff944c11","combined_input_semantic_hash":"eb0cf6c6d6582a78c3a348890fc1c4d85c885e4d290323cf935bd75f72434995","consistent":true,"exit_code":0,"hermit_dependency_version":"1.4.5.456","ontology_release_source_hash":"db7e4d7ee514fef1c62a54c688290940e11ef0a1d9a96bb866d7b74c01f3e8fd","reasoner":"HermiT","robot_jar_sha256":"91890c2e83d0f092dd08731376f154b36610544cfbe8685337a1bf7244ccaa2d","robot_version":"1.9.7","source_package_hash":"c1ed33ee77a14beb4cdabe3fe5ffe107a58fbb351c65c98d93fbc6dd5a02b881","status":"CONSISTENT"}
