{"abox_semantic_hash":"338e2eaaf93dd41909d07a5b27b5e5fb2de6ea004afa332a180ee75690fdc84c","combined_input_semantic_hash":"ab99334a8ca6f0ecccce8e07c324553294c0bc435a11aaca45365e4ac495f512","consistent":true,"exit_code":0,"hermit_dependency_version":"1.4.5.456","ontology_release_source_hash":"db7e4d7ee514fef1c62a54c688290940e11ef0a1d9a96bb866d7b74c01f3e8fd","reasoner":"HermiT","robot_jar_sha256":"91890c2e83d0f092dd08731376f154b36610544cfbe8685337a1bf7244ccaa2d","robot_version":"1.9.7","source_package_hash":"93a516f2327f93f0715ba4e530993dc6549264d230ebc743042960e2ef56fff2","status":"CONSISTENT"}
